{
  "$schema": "http://json-schema.org/draft-07/schema#",
  "title": "MentatLab Flow",
  "description": "Defines the structure for a *.mlab flow file.",
  "type": "object",
  "required": [
    "apiVersion",
    "kind",
    "meta",
    "graph"
  ],
  "properties": {
    "apiVersion": {
      "description": "Schema version for the flow file.",
      "type": "string",
      "pattern": "^v1(alpha|beta)?\\d*$"
    },
    "kind": {
      "description": "The type of the document, which is always 'Flow'.",
      "type": "string",
      "const": "Flow"
    },
    "meta": {
      "type": "object",
      "required": [
        "id",
        "name",
        "version",
        "createdAt"
      ],
      "properties": {
        "id": {
          "description": "Unique identifier for the flow within the workspace.",
          "type": "string"
        },
        "name": {
          "description": "Human-readable name for the flow.",
          "type": "string"
        },
        "description": {
          "description": "A brief description of the flow's purpose.",
          "type": "string"
        },
        "version": {
          "description": "Semantic version of the flow.",
          "type": "string"
        },
        "createdBy": {
          "description": "The user or entity that created the flow.",
          "type": "string"
        },
        "createdAt": {
          "description": "The timestamp when the flow was created.",
          "type": "string",
          "format": "date-time"
        }
      }
    },
    "graph": {
      "type": "object",
      "required": [
        "nodes",
        "edges"
      ],
      "properties": {
        "nodes": {
          "type": "array",
          "items": {
            "$ref": "#/definitions/node"
          }
        },
        "edges": {
          "type": "array",
          "items": {
            "$ref": "#/definitions/edge"
          }
        }
      }
    },
    "layout": {
      "type": "object",
      "properties": {
        "zoom": {
          "type": "number"
        },
        "viewport": {
          "$ref": "#/definitions/position"
        }
      }
    },
    "runConfig": {
      "type": "object",
      "properties": {
        "maxTokens": {
          "type": "integer"
        },
        "temperature": {
          "type": "number"
        },
        "secrets": {
          "type": "array",
          "items": {
            "type": "string"
          }
        }
      }
    }
  },
  "definitions": {
    "position": {
      "type": "object",
      "properties": {
        "x": {
          "type": "number"
        },
        "y": {
          "type": "number"
        }
      }
    },
    "node": {
      "type": "object",
      "required": [
        "id",
        "type",
        "position"
      ],
      "properties": {
        "id": {
          "type": "string"
        },
        "type": {
          "type": "string"
        },
        "position": {
          "$ref": "#/definitions/position"
        },
        "outputs": {
          "type": "object"
        },
        "params": {
          "type": "object"
        }
      }
    },
    "edge": {
      "type": "object",
      "required": [
        "from",
        "to"
      ],
      "properties": {
        "from": {
          "type": "string",
          "pattern": "^[^.]+\\.[^.]+$"
        },
        "to": {
          "type": "string",
          "pattern": "^[^.]+\\.[^.]+$"
        }
      }
    }
  }
}
